{
  "reference_acte": "100583001",
  "initiales_notaire": "CDI/ALG",
  "date_acte": {
    "year": 2025,
    "month": 12,
    "day": 23
  },
  "lieu_signature": {
    "ville": "DARDILLY",
    "code_postal": "69570",
    "adresse": "29 chemin du panorama"
  },
  "notaire": {
    "civilite": "Maître",
    "prenom": "Charlotte",
    "nom": "DIAZ",
    "type_societe": "société par actions simplifiée",
    "nom_societe": "des Cèdres",
    "office": {
      "ville": "TASSIN-LA-DEMI-LUNE",
      "departement": "Rhône",
      "code_postal": "69160",
      "adresse": "93 avenue du 11 Novembre 1918"
    },
    "crpcen": "69182"
  },
  "donateur_1": {
    "civilite": "Monsieur",
    "civilite_court": "M.",
    "prenom": "Dominique",
    "deuxieme_prenom": "Christian",
    "nom": "AUVRAY",
    "profession": "retraité",
    "naissance": {
      "ville": "PARIS 12ÈME ARRONDISSEMENT",
      "code_postal": "75012",
      "date": {"year": 1961, "month": 2, "day": 20}
    },
    "nationalite": "française",
    "adresse": {
      "numero": "29",
      "voie": "chemin du Panorama",
      "ville": "DARDILLY",
      "code_postal": "69570"
    },
    "sexe": "M",
    "age": 64
  },
  "donateur_2": {
    "civilite": "Madame",
    "civilite_court": "Mme",
    "prenom": "Viviane",
    "deuxieme_prenom": "Blanche",
    "troisieme_prenom": "Célie",
    "nom": "AUVRAY",
    "nom_naissance": "ROBIN",
    "profession": "retraitée",
    "naissance": {
      "ville": "TAIN-L'HERMITAGE",
      "code_postal": "26600",
      "date": {"year": 1961, "month": 4, "day": 16}
    },
    "nationalite": "française",
    "adresse": {
      "numero": "29",
      "voie": "chemin du Panorama",
      "ville": "DARDILLY",
      "code_postal": "69570"
    },
    "sexe": "F",
    "age": 64
  },
  "mariage": {
    "ville": "CHANTEMERLE-LES-BLES",
    "code_postal": "26600",
    "date": {"year": 1989, "month": 9, "day": 9},
    "regime": "la participation aux acquêts",
    "articles_code_civil": "1569 et suivants",
    "notaire": {
      "civilite": "Maître",
      "prenom": "Pierre",
      "nom": "COHENDET",
      "ville": "CHAROLLES",
      "code_postal": "71120"
    },
    "contrat": {
      "existe": true,
      "date": {"year": 1989, "month": 6, "day": 24}
    }
  },
  "donataires": [
    {
      "civilite": "Monsieur",
      "prenom": "Antoine",
      "deuxieme_prenom": "Christian",
      "troisieme_prenom": "Edmond",
      "nom": "AUVRAY",
      "profession": "ingénieur référent agrivoltaïque",
      "naissance": {
        "ville": "LYON 9ÈME ARRONDISSEMENT",
        "code_postal": "69009",
        "date": {"year": 1991, "month": 2, "day": 19}
      },
      "adresse": {
        "numero": "16",
        "voie": "cours Lafayette",
        "ville": "LYON 3ÈME ARRONDISSEMENT",
        "code_postal": "69003"
      },
      "situation_familiale": "Célibataire",
      "nationalite": "française",
      "attributions": [
        {
          "designation": "La nue-propriété des parts sociales numérotées de 503 à 751 de la société BLOUGE formant l'article UN de la masse d'une valeur de DEUX CENT NEUF EUROS ET QUATRE-VINGT-DEUX CENTIMES",
          "valeur": 209.82
        },
        {
          "designation": "La nue-propriété des parts sociales numérotées de 3 à 251 de la société BLOUGE formant l'article TROIS de la masse d'une valeur de DEUX CENT NEUF EUROS ET QUATRE-VINGT-DEUX CENTIMES",
          "valeur": 209.82
        }
      ],
      "total_attributions": 419.64,
      "calcul_droits": {
        "donateur_1": {
          "part": 209.82,
          "exonerations": 0.00,
          "donations_incorporees": 0.00,
          "part_imposable": 209.82,
          "abattement_applicable": 100000.00,
          "abattement_utilise": 100000.00,
          "abattement_nouveau": 0.00,
          "part_nette_taxable": 209.82,
          "calcul_detail": "209,82 x 5% : 10,49 €",
          "total_droits": 10.00,
          "droits_a_payer": 10.00
        },
        "donateur_2": {
          "part": 209.82,
          "exonerations": 0.00,
          "donations_incorporees": 0.00,
          "part_imposable": 209.82,
          "abattement_applicable": 100000.00,
          "abattement_utilise": 100000.00,
          "abattement_nouveau": 0.00,
          "part_nette_taxable": 209.82,
          "calcul_detail": "209,82 x 5% : 10,49 €",
          "total_droits": 10.00,
          "droits_a_payer": 10.00
        }
      }
    },
    {
      "civilite": "Madame",
      "prenom": "Mathilde",
      "deuxieme_prenom": "Yvonne",
      "troisieme_prenom": "Nicole",
      "nom": "AUVRAY",
      "profession": "gérante d'une entreprise de conseil",
      "naissance": {
        "ville": "LYON 9ÈME ARRONDISSEMENT",
        "code_postal": "69009",
        "date": {"year": 1993, "month": 8, "day": 9}
      },
      "adresse": {
        "numero": "18",
        "voie": "rue Milton",
        "ville": "PARIS 9ÈME ARRONDISSEMENT",
        "code_postal": "75009"
      },
      "situation_familiale": "Célibataire",
      "nationalite": "française",
      "attributions": [
        {
          "designation": "La nue-propriété des parts sociales numérotées de 752 à 1000 de la société BLOUGE formant l'article DEUX de la masse d'une valeur de DEUX CENT NEUF EUROS ET QUATRE-VINGT-DEUX CENTIMES",
          "valeur": 209.82
        },
        {
          "designation": "La nue-propriété des parts sociales numérotées de 252 à 500 de la société BLOUGE formant l'article QUATRE de la masse d'une valeur de DEUX CENT NEUF EUROS ET QUATRE-VINGT-DEUX CENTIMES",
          "valeur": 209.82
        }
      ],
      "total_attributions": 419.64,
      "calcul_droits": {
        "donateur_1": {
          "part": 209.82,
          "exonerations": 0.00,
          "donations_incorporees": 0.00,
          "part_imposable": 209.82,
          "abattement_applicable": 100000.00,
          "abattement_utilise": 100000.00,
          "abattement_nouveau": 0.00,
          "part_nette_taxable": 209.82,
          "calcul_detail": "209,82 x 5% : 10,49 €",
          "total_droits": 10.00,
          "droits_a_payer": 10.00
        },
        "donateur_2": {
          "part": 209.82,
          "exonerations": 0.00,
          "donations_incorporees": 0.00,
          "part_imposable": 209.82,
          "abattement_applicable": 100000.00,
          "abattement_utilise": 100000.00,
          "abattement_nouveau": 0.00,
          "part_nette_taxable": 209.82,
          "calcul_detail": "209,82 x 5% : 10,49 €",
          "total_droits": 10.00,
          "droits_a_payer": 10.00
        }
      }
    }
  ],
  "nombre_enfants_lettres": "deux",
  "nombre_donataires": 2,
  "donation_anterieure": {
    "existe": true,
    "notaire": {
      "civilite": "Maître",
      "nom": "ROBLOT-DIAZ",
      "ville": "SEREZIN-DU-RHÔNE",
      "code_postal": "69360"
    },
    "date": {"year": 2021, "month": 12, "day": 23},
    "donateurs": "Monsieur et Madame Dominique et Viviane AUVRAY, donateurs aux présentes",
    "objet": "la nue-propriété d'un bien sis à DARDILLY (69570), 29 chemin du panorama",
    "valeur": 400000.00,
    "valeur_lettres": "QUATRE CENT MILLE EUROS",
    "rappel_texte": "l'acte de donation consenti par Monsieur et Madame Dominique et Viviane AUVRAY, DONATEURS aux présentes, au profit de leurs deux enfants, Monsieur Antoine AUVRAY et Madame Mathilde AUVRAY, donataires aux présentes, suivant acte reçu par Maître ROBLOT DIAZ, notaire à SEREZIN DU RHONE (69360), le 23 décembre 2021",
    "calcul_droits": "Donation de Monsieur Dominique AUVRAY\nAu profit de Monsieur Antoine AUVRAY\nAbsence de droits : Compte tenu de la valeur transmise et de l'abattement bénéficiant au DONATAIRE, la présente donation ne génère pas de droits.\n- Valeur reçue 100 000,00 EUR\n- Abattement légal disponible 100 000,00 EUR\n- Base taxable Néant\n\nAu profit de Madame Mathilde AUVRAY\nAbsence de droits : Compte tenu de la valeur transmise et de l'abattement bénéficiant au DONATAIRE, la présente donation ne génère pas de droits\n- Valeur reçue 100 000,00 EUR\n- Abattement légal disponible 100 000,00 EUR\n- Base taxable Néant\n\nDonation de Madame Viviane AUVRAY\nAu profit de Monsieur Antoine AUVRAY\nAbsence de droits : Compte tenu de la valeur transmise et de l'abattement bénéficiant au DONATAIRE, la présente donation ne génère pas de droits.\n- Valeur reçue 100 000,00 EUR\n- Abattement légal disponible 100 000,00 EUR\n- Base taxable Néant\n\nAu profit de Madame Mathilde AUVRAY\nAbsence de droits : Compte tenu de la valeur transmise et de l'abattement bénéficiant au DONATAIRE, la présente donation ne génère pas de droits\n- Valeur reçue 100 000,00 EUR\n- Abattement légal disponible 100 000,00 EUR\n- Base taxable Néant"
  },
  "societe": {
    "existe": true,
    "denomination": "BLOUGE",
    "siren": "985331354",
    "rcs": "LYON",
    "capital": 1000.00,
    "capital_lettres": "MILLE EUROS",
    "nombre_parts": 1000,
    "nombre_parts_lettres": "MILLE",
    "valeur_part": 1.00,
    "valeur_part_lettres": "UN EURO",
    "siege": {
      "ville": "DARDILLY",
      "code_postal": "69570",
      "adresse": "29 chemin du Panorama"
    },
    "tribunal_commerce": "LYON",
    "duree": 99,
    "duree_lettres": "quatre-vingt-dix-neuf",
    "constitution": {
      "date": {"year": 2024, "month": 2, "day": 19}
    },
    "objet_social": [
      "La propriété, la détention, la gestion et la cession de valeurs mobilières et immobilières, droits sociaux ou tous autres titres cotés ou non cotés, de SCPI ou d'OPCI, détenus en pleine propriété, nue-propriété ou usufruit, acquis par voie d'achat, d'échange, d'apport ou autrement",
      "La propriété, la détention, la gestion, la construction, l'administration et l'exploitation par bail, location ou autrement de tous immeubles et droits immobiliers détenus en pleine propriété, nue-propriété ou usufruit, dont elle pourrait devenir propriétaire par voie d'acquisition, d'apport, d'échange ou autrement",